<?xml version="1.0" encoding="UTF-8"?>
<list xmlns:xsi="http://www.w3.org/2001/XMLSchema-instance"
      xmlns="http://l2j.org"
      xsi:schemaLocation="http://l2j.org multisell.xsd">
    <npcs>
        34292 <!-- Chef Monkey -->
    </npcs>
    <item>
        <ingredient id="70304" count="50"/> <!-- Tuna Fish -->
        <production id="90045"/> <!-- Blessed Mysterious Soulshot (No-grade) -->
    </item>

    <!-- evo -->
    <item>
        <ingredient id="70304" count="100"/> <!-- Tuna Fish -->
        <production id="91031"/> <!-- Blessed Mysterious Soulshot (No-grade) -->
    </item>
    <item>
        <ingredient id="70304" count="100"/> <!-- Tuna Fish -->
        <production id="91032"/> <!-- Blessed Mysterious Soulshot (No-grade) -->
    </item>
    <item>
        <ingredient id="70304" count="100"/> <!-- Tuna Fish -->
        <production id="91033"/> <!-- Blessed Mysterious Soulshot (No-grade) -->
    </item>
    <item>
        <ingredient id="70304" count="100"/> <!-- Tuna Fish -->
        <production id="91034"/> <!-- Blessed Mysterious Soulshot (No-grade) -->
    </item>


    <item>
        <ingredient id="70304" count="15"/> <!-- Tuna Fish -->
        <production id="71438"/> <!-- Blessed Mysterious Soulshot (No-grade) -->
    </item>


    <item>
        <ingredient id="70304" count="35"/> <!-- Tuna Fish -->
        <production id="49762"/> <!-- Blessed Mysterious Soulshot (No-grade) -->
    </item>
    <item>
        <ingredient id="70304" count="25"/> <!-- Tuna Fish -->
        <production id="49763"/> <!-- Blessed Mysterious Soulshot (No-grade) -->
    </item>

    <item>
        <ingredient id="70304" count="1000"/> <!-- Tuna Fish -->
        <production id="92472"/> <!-- Blessed Mysterious Soulshot (No-grade) -->
    </item>
</list>