<?xml version="1.0" encoding="UTF-8"?>
<list xmlns:xsi="http://www.w3.org/2001/XMLSchema-instance"
      xmlns="http://l2j.org"
      xsi:schemaLocation="http://l2j.org ../multisell.xsd">
    <npcs>
        -1 <!-- CB -->
    </npcs>
    <item>
        <!-- Adena -->
        <ingredient count="2" id="57"/>
        <!-- Proof of Blood -->
        <production id="17"/>
    </item>
    <item>
        <!-- Adena -->
        <ingredient count="3" id="57"/>
        <!-- Proof of Alliance -->
        <production id="1341"/>
    </item>
    <item>
        <!-- Adena -->
        <ingredient count="5" id="57"/>
        <!-- Proof of Aspiration -->
        <production id="1342"/>
    </item>
    <item>
        <!-- Adena -->
        <ingredient count="7" id="57"/>
        <!-- Blood-stained Cloth -->
        <production id="1343"/>
    </item>
    <item>
        <!-- Adena -->
        <ingredient count="9" id="57"/>
        <!-- Portal Stone -->
        <production id="1344"/>
    </item>
    <item>
        <!-- Adena -->
        <ingredient count="15" id="57"/>
        <!-- Proof of Blood -->
        <production id="1345"/>
    </item>
    <item>
        <!-- Adena -->
        <ingredient count="1200" id="57"/>
        <!-- Proof of Blood -->
        <production id="1458"/>
    </item>
    <item>
        <!-- Adena -->
        <ingredient count="4200" id="57"/>
        <!-- Proof of Blood -->
        <production id="1459"/>
    </item>
    <item>
        <!-- Adena -->
        <ingredient count="25000" id="57"/>
        <!-- Proof of Blood -->
        <production id="1460"/>
    </item>
    <item>
        <!-- Adena -->
        <ingredient count="100000" id="57"/>
        <!-- Proof of Blood -->
        <production id="1461"/>
    </item>
    <item>
        <!-- Adena -->
        <ingredient count="250000" id="57"/>
        <!-- Proof of Blood -->
        <production id="1462"/>
    </item>
    <item>
        <!-- Adena -->
        <ingredient count="1000" id="57"/>
        <!-- Proof of Alliance -->
        <production id="2130"/>
    </item>
    <item>
        <!-- Adena -->
        <ingredient count="3000" id="57"/>
        <!-- Proof of Aspiration -->
        <production id="2131"/>
    </item>
    <item>
        <!-- Adena -->
        <ingredient count="10000" id="57"/>
        <!-- Blood-stained Cloth -->
        <production id="2132"/>
    </item>
    <item>
        <!-- Adena -->
        <ingredient count="3000000" id="57"/>
        <!-- Proof of Blood -->
        <production id="2133"/>
    </item>
    <item>
        <!-- Adena -->
        <ingredient count="10000000" id="57"/>
        <!-- Proof of Blood -->
        <production id="2134"/>
    </item>
    <item>
        <!-- Adena -->
        <ingredient count="2000" id="57"/>
        <!-- Proof of Blood -->
        <production id="1661"/>
    </item>
    <item>
        <!-- Adena -->
        <ingredient count="200" id="57"/>
        <!-- Proof of Blood -->
        <production id="5589"/>
    </item>
    <item>
        <!-- Adena -->
        <ingredient count="250" id="57"/>
        <!-- Proof of Alliance -->
        <production id="1785"/>
    </item>
    <item>
        <!-- Adena -->
        <ingredient count="400" id="57"/>
        <!-- Proof of Aspiration -->
        <production id="3031"/>
    </item>
    <item>
        <!-- Adena -->
        <ingredient count="2000" id="57"/>
        <!-- Blood-stained Cloth -->
        <production id="737"/>
    </item>
    <item>
        <!-- Adena -->
        <ingredient count="2000" id="57"/>
        <!-- Proof of Blood -->
        <production id="736"/>
    </item>
    <item>
        <!-- Adena -->
        <ingredient count="50000" id="57"/>
        <!-- Proof of Alliance -->
        <production id="1829"/>
    </item>
    <item>
        <!-- Adena -->
        <ingredient count="10000" id="57"/>
        <!-- Proof of Aspiration -->
        <production id="1830"/>
    </item>

    <item>
        <!-- Adena -->
        <ingredient count="1000000" id="57"/>
        <!-- Proof of Aspiration -->
        <production id="1538"/>
    </item>
    <item>
        <!-- Adena -->
        <ingredient count="1000000" id="57"/>
        <!-- Proof of Aspiration -->
        <production id="3936"/>
    </item>


    <item>
        <!-- Adena -->
        <ingredient count="150" id="57"/>
        <!-- Proof of Aspiration -->
        <production id="1831"/>
    </item>
    <item>
        <!-- Adena -->
        <ingredient count="400" id="57"/>
        <!-- Proof of Aspiration -->
        <production id="1832"/>
    </item>

    <item>
        <!-- Adena -->
        <ingredient count="4000" id="57"/>
        <!-- Proof of Aspiration -->
        <production id="1374"/>
    </item>
    <item>
        <!-- Adena -->
        <ingredient count="6000" id="57"/>
        <!-- Proof of Aspiration -->
        <production id="1375"/>
    </item>
    <item>
        <!-- Adena -->
        <ingredient count="6000" id="57"/>
        <!-- Proof of Aspiration -->
        <production id="6036"/>
    </item>
    <item>
        <!-- Adena -->
        <ingredient count="10000" id="57"/>
        <!-- Proof of Aspiration -->
        <production id="5591"/>
    </item>
    <item>
        <!-- Adena -->
        <ingredient count="50000" id="57"/>
        <!-- Proof of Aspiration -->
        <production id="5592"/>
    </item>
    <item>
        <!-- Adena -->
        <ingredient count="50" id="57"/>
        <!-- Blood-stained Cloth -->
        <production id="91912"/>
    </item>
    <item>
        <!-- Adena -->
        <ingredient count="1500" id="57"/>
        <!-- Blood-stained Cloth -->
        <production id="91252"/>
    </item>
    <item>
        <!-- Adena -->
        <ingredient count="200" id="57"/>
        <!-- Proof of Alliance -->
        <production id="5589"/>
    </item>
    <item>
        <!-- Adena -->
        <ingredient count="8000000" id="57"/>
        <!-- Proof of Aspiration -->
        <production id="5126"/>
    </item>
    <item>
        <!-- Adena -->
        <ingredient count="1500" id="57"/>
        <!-- Blood-stained Cloth -->
        <production id="4679"/>
    </item>
    <item>
        <!-- Adena -->
        <ingredient count="65000" id="57"/>
        <!-- Blood-stained Cloth -->
        <production id="8615"/>
    </item>
    <item>
        <!-- Adena -->
        <ingredient count="20000" id="57"/>
        <!-- Blood-stained Cloth -->
        <production id="49543"/>
    </item>
    <item>
        <!-- Adena -->
        <ingredient count="400000" id="57"/>
        <!-- Blood-stained Cloth -->
        <production id="49684"/>
    </item>
    <item>
        <!-- Adena -->
        <ingredient count="210" id="57"/>
        <!-- Blood-stained Cloth -->
        <production id="2508"/>
    </item>
    <item>
        <!-- Adena -->
        <ingredient count="100000" id="57"/>
        <!-- Blood-stained Cloth -->
        <production id="8871"/>
    </item>
    <item>
        <!-- Adena -->
        <ingredient count="150000" id="57"/>
        <!-- Blood-stained Cloth -->
        <production id="49518"/>
    </item>
    <item>
        <!-- Adena -->
        <ingredient count="2000000" id="57"/>
        <!-- Blood-stained Cloth -->
        <production id="8618"/>
    </item>
    <item>
        <!-- Adena -->
        <ingredient count="2000000" id="57"/>
        <!-- Blood-stained Cloth -->
        <production id="8619"/>
    </item>
    <item>
        <!-- Adena -->
        <ingredient count="1000000" id="57"/>
        <!-- Blood-stained Cloth -->
        <production id="49758"/>
    </item>
    <item>
        <!-- Adena -->
        <ingredient count="50000" id="57"/>
        <!-- Blood-stained Cloth -->
        <production id="1419"/>
    </item>
    <item>
        <!-- Adena -->
        <ingredient count="1000000" id="57"/>
        <!-- Blood-stained Cloth -->
        <production id="29676"/>
    </item>
    <item>
        <!-- Adena -->
        <ingredient count="10000000" id="57"/>
        <!-- Blood-stained Cloth -->
        <production id="90038"/>
    </item>
    <item>
        <!-- Adena -->
        <ingredient count="10000000" id="57"/>
        <!-- Blood-stained Cloth -->
        <production id="90039"/>
    </item>
    <item>
        <!-- Adena -->
        <ingredient count="10000000" id="57"/>
        <!-- Blood-stained Cloth -->
        <production id="90040"/>
    </item>
    <item>
        <!-- Adena -->
        <ingredient count="10000000" id="57"/>
        <!-- Blood-stained Cloth -->
        <production id="90041"/>
    </item>
    <item>
        <!-- Adena -->
        <ingredient count="10000000" id="57"/>
        <!-- Blood-stained Cloth -->
        <production id="90042"/>
    </item>
</list>