<?xml version="1.0" encoding="UTF-8"?>
<list xmlns:xsi="http://www.w3.org/2001/XMLSchema-instance"
      xmlns="http://l2j.org"
      xsi:schemaLocation="http://l2j.org multisell.xsd"
      apply-taxes="true">
    <npcs>
        30300 <!-- Pushkin -->
        30298 <!-- Pinter -->
        30317 <!-- Kluto -->
        30458 <!-- Poitan -->
        30471 <!-- Rupio -->
        30846 <!-- Wilbert -->
        30678 <!-- Helton -->
        30688 <!-- Duning -->
        31271 <!-- Hilda -->
        31583 <!-- Feynn -->
        30283 <!-- Altran -->
    </npcs>
    <item>
        <!-- Recipe: Braided Hemp -->
        <ingredient id="2135" consume="false"/>
        <!-- Stem -->
        <ingredient count="5" id="1864"/>
        <!-- Braided Hemp -->
        <production id="1878"/>
    </item>
    <item>
        <!-- Recipe: Cokes -->
        <ingredient id="2136" consume="false"/>
        <!-- Coal -->
        <ingredient count="3" id="1870"/>
        <!-- Charcoal -->
        <ingredient count="3" id="1871"/>
        <!-- Cokes -->
        <production id="1879"/>
    </item>
    <item>
        <!-- Recipe: Steel -->
        <ingredient id="2137" consume="false"/>
        <!-- Varnish -->
        <ingredient count="5" id="1865"/>
        <!-- Iron Ore -->
        <ingredient count="5" id="1869"/>
        <!-- Steel -->
        <production id="1880"/>
    </item>
    <item>
        <!-- Recipe: Coarse Bone Powder (100%) -->
        <ingredient id="2138" consume="false"/>
        <!-- Animal Bone -->
        <ingredient count="10" id="1872"/>
        <!-- Coarse Bone Powder -->
        <production id="1881"/>
    </item>
    <item>
        <!-- Recipe: Leather -->
        <ingredient id="1814" consume="false"/>
        <!-- Animal Skin -->
        <ingredient count="6" id="1867"/>
        <!-- Leather -->
        <production id="1882"/>
    </item>
    <item>
        <!-- Recipe: Steel Mold -->
        <ingredient id="2139" consume="false"/>
        <!-- Braided Hemp -->
        <ingredient count="5" id="1878"/>
        <!-- Iron Ore -->
        <ingredient count="5" id="1869"/>
        <!-- Coal -->
        <ingredient count="5" id="1870"/>
        <!-- Steel Mold -->
        <production id="1883"/>
    </item>
    <item>
        <!-- Recipe: Cord -->
        <ingredient id="1817" consume="false"/>
        <!-- Steel -->
        <ingredient count="2" id="1880"/>
        <!-- Thread -->
        <ingredient count="25" id="1868"/>
        <!-- Cord -->
        <production count="20" id="1884"/>
    </item>
    <item>
        <!-- Recipe: High-Grade Suede -->
        <ingredient id="2140" consume="false"/>
        <!-- Coarse Bone Powder -->
        <ingredient id="1881"/>
        <!-- Suede -->
        <ingredient count="3" id="1866"/>
        <!-- High-Grade Suede -->
        <production id="1885"/>
    </item>
    <item>
        <!-- Recipe: Silver Mold -->
        <ingredient id="2141" consume="false"/>
        <!-- Braided Hemp -->
        <ingredient count="5" id="1878"/>
        <!-- Cokes -->
        <ingredient count="5" id="1879"/>
        <!-- Silver Nugget -->
        <ingredient count="10" id="1873"/>
        <!-- Silver Mold -->
        <production id="1886"/>
    </item>
    <item>
        <!-- Recipe: Varnish of Purity -->
        <ingredient id="2142" consume="false"/>
        <!-- Coarse Bone Powder -->
        <ingredient count="3" id="1881"/>
        <!-- Varnish -->
        <ingredient count="3" id="1865"/>
        <!-- Stone of Purity -->
        <ingredient id="1875"/>
        <!-- Varnish of Purity -->
        <production id="1887"/>
    </item>
    <item>
        <!-- Recipe: Synthetic Cokes -->
        <ingredient id="2143" consume="false"/>
        <!-- Cokes -->
        <ingredient count="3" id="1879"/>
        <!-- Oriharukon Ore -->
        <ingredient id="1874"/>
        <!-- Synthetic Cokes -->
        <production id="1888"/>
    </item>
    <item>
        <!-- Recipe: Compound Braid -->
        <ingredient id="2144" consume="false"/>
        <!-- Braided Hemp -->
        <ingredient count="5" id="1878"/>
        <!-- Thread -->
        <ingredient count="5" id="1868"/>
        <!-- Compound Braid -->
        <production id="1889"/>
    </item>
    <item>
        <!-- Recipe: Mithril Alloy -->
        <ingredient id="2145" consume="false"/>
        <!-- Varnish of Purity -->
        <ingredient id="1887"/>
        <!-- Steel -->
        <ingredient count="2" id="1880"/>
        <!-- Mithril Ore -->
        <ingredient id="1876"/>
        <!-- Mithril Alloy -->
        <production id="1890"/>
    </item>
    <item>
        <!-- Recipe: Artisan's frame -->
        <ingredient id="2146" consume="false"/>
        <!-- Steel Mold -->
        <ingredient id="1883"/>
        <!-- Varnish of Purity -->
        <ingredient count="5" id="1887"/>
        <!-- Adamantite Nugget -->
        <ingredient count="10" id="1877"/>
        <!-- Artisan's Frame -->
        <production id="1891"/>
    </item>
    <item>
        <!-- Recipe: Blacksmith's frame -->
        <ingredient id="2147" consume="false"/>
        <!-- Silver Mold -->
        <ingredient id="1886"/>
        <!-- Varnish of Purity -->
        <ingredient count="5" id="1887"/>
        <!-- Mithril Ore -->
        <ingredient count="10" id="1876"/>
        <!-- Blacksmith's Frame -->
        <production id="1892"/>
    </item>
    <item>
        <!-- Recipe: Oriharukon -->
        <ingredient id="1825" consume="false"/>
        <!-- Synthetic Cokes -->
        <ingredient id="1888"/>
        <!-- Silver Nugget -->
        <ingredient count="12" id="1873"/>
        <!-- Oriharukon Ore -->
        <ingredient count="4" id="1874"/>
        <!-- Oriharukon -->
        <production id="1893"/>
    </item>
    <item>
        <!-- Recipe: Crafted Leather -->
        <ingredient id="2148" consume="false"/>
        <!-- Cord -->
        <ingredient count="4" id="1884"/>
        <!-- Leather -->
        <ingredient count="4" id="1882"/>
        <!-- Coal -->
        <ingredient count="4" id="1870"/>
        <!-- Crafted Leather -->
        <production id="1894"/>
    </item>
    <item>
        <!-- Recipe: Metallic Fiber -->
        <ingredient id="2149" consume="false"/>
        <!-- Cord -->
        <ingredient count="20" id="1884"/>
        <!-- Silver Nugget -->
        <ingredient count="15" id="1873"/>
        <!-- Metallic Fiber -->
        <production count="20" id="1895"/>
    </item>
    <item>
        <!-- Recipe: Metallic Thread(100%) -->
        <ingredient id="5472" consume="false"/>
        <!-- Thread -->
        <ingredient count="10" id="1868"/>
        <!-- Iron Ore -->
        <ingredient count="5" id="1869"/>
        <!-- Metallic Thread -->
        <production id="5549"/>
    </item>
    <item>
        <!-- Recipe: Metal Hardener (100%) -->
        <ingredient id="5231" consume="false"/>
        <!-- Stem -->
        <ingredient count="10" id="1864"/>
        <!-- Varnish -->
        <ingredient count="10" id="1865"/>
        <!-- Iron Ore -->
        <ingredient count="10" id="1869"/>
        <!-- Metal Hardener -->
        <production id="5220"/>
    </item>
    <item>
        <!-- Recipe: Durable Metal Plate(100%) -->
        <ingredient id="5473" consume="false"/>
        <!-- Metallic Thread -->
        <ingredient count="5" id="5549"/>
        <!-- Mithril Ore -->
        <ingredient count="5" id="1876"/>
        <!-- Durable Metal Plate -->
        <production id="5550"/>
    </item>
    <item>
        <!-- Cord -->
        <ingredient count="40" id="1884"/>
        <!-- Durable Metal Plate -->
        <ingredient count="10" id="5550"/>
        <!-- Adamantite Nugget -->
        <ingredient count="15" id="1877"/>
        <!-- Reorin's Mold -->
        <production id="5551"/>
    </item>
    <item>
        <!-- Artisan's Frame -->
        <ingredient id="1891"/>
        <!-- Mold Hardener -->
        <ingredient count="10" id="4041"/>
        <!-- Enria -->
        <ingredient count="5" id="4042"/>
        <!-- Warsmith's Mold -->
        <production id="5552"/>
    </item>
    <item>
        <!-- Maestro Anvil Lock -->
        <ingredient count="3" id="4046"/>
        <!-- Mold Lubricant -->
        <ingredient count="20" id="4040"/>
        <!-- Thons -->
        <ingredient count="10" id="4044"/>
        <!-- Adena -->
        <ingredient count="541824" id="57"/>
        <!-- Arcsmith's Anvil -->
        <production id="5553"/>
    </item>
    <item>
        <!-- Maestro Holder -->
        <ingredient count="2" id="4045"/>
        <!-- Mold Glue -->
        <ingredient count="10" id="4039"/>
        <!-- Thread -->
        <ingredient count="20" id="1868"/>
        <!-- Warsmith's Holder -->
        <production id="5554"/>
    </item>
</list>