<?xml version="1.0" encoding="UTF-8"?>
<list xmlns:xsi="http://www.w3.org/2001/XMLSchema-instance"
      xmlns="http://l2j.org"
      xsi:schemaLocation="http://l2j.org multisell.xsd"
      apply-taxes="true">
    <!-- Immortal: Update 270 Prot -->
    <npcs>
        30020 <!-- Baggins -->
    </npcs>
    <item>
        <ingredient id="71078"/> <!-- Talisman of Authority Fragment -->
        <production id="71080"/> <!-- Talisman of Authority Lv. 1 -->
    </item>
    <item>
        <ingredient id="71084"/> <!-- Talisman of Authority Lv. 5 -->
        <ingredient count="3" id="71078"/> <!-- Talisman of Authority Fragment -->
        <ingredient count="20000000" id="57"/> <!-- Adena -->
        <production id="71085"/> <!-- Noble Talisman of Authority Lv. 1 -->
    </item>
    <item>
        <ingredient id="71089"/> <!-- Noble Talisman of Authority Lv. 5 -->
        <ingredient count="6" id="71078"/> <!-- Talisman of Authority Fragment -->
        <ingredient count="40000000" id="57"/> <!-- Adena -->
        <production id="71090"/> <!-- Radiant Talisman of Authority Lv. 1 -->
    </item>
</list>