<?xml version="1.0" encoding="UTF-8"?>
<list xmlns:xsi="http://www.w3.org/2001/XMLSchema-instance"
      xmlns="http://l2j.org"
      xsi:schemaLocation="http://l2j.org multisell.xsd"
      chance-based="true">
    <npcs>
        34262 <!-- Sibi Manager -->
    </npcs>
    <item>
        <!-- Sibi's Coin -->
        <ingredient id="49783" count="20"/>
        <production id="32253"/> <!-- Infinite Mithril Quiver -->
        <production id="32253" chance="1"/> <!-- Infinite Mithril Quiver -->
        <production id="32249" chance="1"/> <!-- Infinite Wooden Quiver -->
        <production id="32250" chance="1"/> <!-- Infinite Bone Quiver -->
        <production id="32251" chance="1"/> <!-- Infinite Steel Quiver -->
        <production id="32252" chance="1"/> <!-- Infinite Silver Quiver -->
        <production id="17" count="100" chance="19"/> <!-- Wooden Arrow -->
        <production id="1341" count="200" chance="19"/> <!-- Bone Arrow -->
        <production id="1342" count="100" chance="19"/> <!-- Steel Arrow -->
        <production id="1343" count="100" chance="19"/> <!-- Silver Arrow -->
        <production id="1344" count="100" chance="19"/> <!-- Mithril Arrow -->
    </item>
</list>