<?xml version="1.0" encoding="UTF-8"?>
<list xmlns:xsi="http://www.w3.org/2001/XMLSchema-instance"
      xmlns="http://l2j.org"
      xsi:schemaLocation="http://l2j.org multisell.xsd">
    <!-- 272 Prot -->
    <npcs>
        -1 <!-- Dimensional Merchant / Everywhere -->
    </npcs>
    <item>
        <!-- Ticket -->
        <ingredient id="90907"/>
        <!-- Soulshots  -->
        <production count="500" id="91927"/>
    </item>

    <item>
        <!-- Ticket -->
        <ingredient id="90907"/>
        <!-- Blessed Spiritshot -->
        <production count="287" id="91928"/>
    </item>
    <item>
        <!-- Ticket -->
        <ingredient id="90907"/>
        <!-- Blessed Spiritshot -->
        <production count="134" id="91930"/>
    </item>
</list>