<?xml version="1.0" encoding="UTF-8"?>
<list xmlns:xsi="http://www.w3.org/2001/XMLSchema-instance"
      xmlns="http://l2j.org"
      xsi:schemaLocation="http://l2j.org multisell.xsd">
    <npcs>
        30841 <!-- Carson -->
    </npcs>
    <item>
        <ingredient id="93974"/> <!-- Ticket -->
        <production id="93968" count="10"/> <!-- Due -->
    </item>
    <item>
        <ingredient id="93974"/> <!-- Ticket -->
        <production id="93969" count="10"/> <!-- Due -->
    </item>
    <item>
        <ingredient id="93974"/> <!-- Ticket -->
        <production id="93970" count="10"/> <!-- Due -->
    </item>
    <item>
        <ingredient id="93974"/> <!-- Ticket -->
        <production id="93971" count="10"/> <!-- Due -->
    </item>
    <item>
        <ingredient id="93974"/> <!-- Ticket -->
        <production id="93972" count="10"/> <!-- Due -->
    </item>
    <item>
        <ingredient id="93974"/> <!-- Ticket -->
        <production id="93973" count="10"/> <!-- Due -->
    </item>
</list>